{
  "contract_id": "io-trade-cost-source-collection-manifest-v1",
  "contract_version": "1.0.0",
  "scope": {
    "company_cd": "DSE",
    "subs_cd": "C100",
    "origin_site_cd": "V100",
    "destination_site_cds": ["V101", "V102", "V103", "V104"]
  },
  "manifest_status": "DRAFT",
  "collected_at": "2026-09-16T00:00:00Z",
  "entries": [
    {
      "entry_id": "c100-customs-fx",
      "source_domain": "CUSTOMS_FX",
      "jurisdiction_country_codes": ["AE", "CN", "JP", "SA"],
      "assignment_status": "UNASSIGNED",
      "source_owner": null,
      "source_system": null,
      "collection_method": null,
      "collection_cadence": null,
      "expected_freshness_hours": null,
      "effective_from": null,
      "effective_to": null,
      "raw_content_hash": null,
      "evidence_reference": null,
      "license_review_status": "PENDING",
      "notes": "Destination customs-recognized exchange-rate owners and collectors remain unassigned."
    },
    {
      "entry_id": "c100-customs-tariff",
      "source_domain": "CUSTOMS_TARIFF",
      "jurisdiction_country_codes": ["AE", "CN", "JP", "SA"],
      "assignment_status": "UNASSIGNED",
      "source_owner": null,
      "source_system": null,
      "collection_method": null,
      "collection_cadence": null,
      "expected_freshness_hours": null,
      "effective_from": null,
      "effective_to": null,
      "raw_content_hash": null,
      "evidence_reference": null,
      "license_review_status": "PENDING",
      "notes": "Official tariff collectors and legal-rule approval ownership remain unassigned."
    },
    {
      "entry_id": "c100-import-tax-profile",
      "source_domain": "IMPORT_TAX_PROFILE",
      "jurisdiction_country_codes": ["AE", "CN", "JP", "SA"],
      "assignment_status": "UNASSIGNED",
      "source_owner": null,
      "source_system": null,
      "collection_method": null,
      "collection_cadence": null,
      "expected_freshness_hours": null,
      "effective_from": null,
      "effective_to": null,
      "raw_content_hash": null,
      "evidence_reference": null,
      "license_review_status": "PENDING",
      "notes": "Importer VAT registration and recoverability evidence remain unassigned."
    },
    {
      "entry_id": "c100-item-classification",
      "source_domain": "ITEM_CLASSIFICATION",
      "jurisdiction_country_codes": ["AE", "CN", "JP", "SA"],
      "assignment_status": "UNASSIGNED",
      "source_owner": null,
      "source_system": null,
      "collection_method": null,
      "collection_cadence": null,
      "expected_freshness_hours": null,
      "effective_from": null,
      "effective_to": null,
      "raw_content_hash": null,
      "evidence_reference": null,
      "license_review_status": "PENDING",
      "notes": "HS version and destination national tariff-line ownership remain unassigned."
    },
    {
      "entry_id": "c100-item-origin",
      "source_domain": "ITEM_ORIGIN",
      "jurisdiction_country_codes": ["KR"],
      "assignment_status": "UNASSIGNED",
      "source_owner": null,
      "source_system": null,
      "collection_method": null,
      "collection_cadence": null,
      "expected_freshness_hours": null,
      "effective_from": null,
      "effective_to": null,
      "raw_content_hash": null,
      "evidence_reference": null,
      "license_review_status": "PENDING",
      "notes": "Manufacturing-origin authority remains unassigned; shipping country is not origin evidence."
    },
    {
      "entry_id": "c100-item-physical-attribute",
      "source_domain": "ITEM_PHYSICAL_ATTRIBUTE",
      "jurisdiction_country_codes": ["KR"],
      "assignment_status": "UNASSIGNED",
      "source_owner": null,
      "source_system": null,
      "collection_method": null,
      "collection_cadence": null,
      "expected_freshness_hours": null,
      "effective_from": null,
      "effective_to": null,
      "raw_content_hash": null,
      "evidence_reference": null,
      "license_review_status": "PENDING",
      "notes": "Item weight and volume with physical UOM and effective date remain unassigned."
    },
    {
      "entry_id": "c100-lane-charge",
      "source_domain": "LANE_CHARGE",
      "jurisdiction_country_codes": ["AE", "CN", "JP", "SA"],
      "assignment_status": "UNASSIGNED",
      "source_owner": null,
      "source_system": null,
      "collection_method": null,
      "collection_cadence": null,
      "expected_freshness_hours": null,
      "effective_from": null,
      "effective_to": null,
      "raw_content_hash": null,
      "evidence_reference": null,
      "license_review_status": "PENDING",
      "notes": "International, handling, insurance, and inland charge contracts remain unassigned."
    },
    {
      "entry_id": "c100-preferential-origin-evidence",
      "source_domain": "PREFERENTIAL_ORIGIN_EVIDENCE",
      "jurisdiction_country_codes": ["AE", "CN", "JP", "SA"],
      "assignment_status": "UNASSIGNED",
      "source_owner": null,
      "source_system": null,
      "collection_method": null,
      "collection_cadence": null,
      "expected_freshness_hours": null,
      "effective_from": null,
      "effective_to": null,
      "raw_content_hash": null,
      "evidence_reference": null,
      "license_review_status": "PENDING",
      "notes": "Agreement-specific eligibility and certificate verification remain unassigned."
    },
    {
      "entry_id": "c100-purchase-shipment",
      "source_domain": "PURCHASE_SHIPMENT",
      "jurisdiction_country_codes": ["KR"],
      "assignment_status": "UNASSIGNED",
      "source_owner": null,
      "source_system": null,
      "collection_method": null,
      "collection_cadence": null,
      "expected_freshness_hours": null,
      "effective_from": null,
      "effective_to": null,
      "raw_content_hash": null,
      "evidence_reference": null,
      "license_review_status": "PENDING",
      "notes": "Purchase invoice, shipment, Incoterms, quantity, currency, and insurance owner remain unassigned."
    }
  ],
  "approved_by": null,
  "approved_at": null,
  "content_hash": "f46ed61f52ed0fde82f3aec9735a4f0babc643a9a7e262b4531104df31b4cc2c"
}
